[
    {
        "id": 1,
        "m": "Vix33",
        "ip": "192.168.49.77",
        "p": "Depuracion CC - rpadepuracion3",
        "o": "LINUX",
        "u": "ugenome",
        "pw": "UbuntuCyb2026\\$"
    },
    {
        "id": 2,
        "m": "Vix34",
        "ip": "192.168.49.78",
        "p": "Depuracio Ext - p-lggarciah",
        "o": "LINUX",
        "u": "ugenome",
        "pw": "UbuntuCyb2026\\$"
    },
    {
        "id": 3,
        "m": "Vix37",
        "ip": "192.168.49.81",
        "p": "Ajustes (Sin Validacion) - rpaajustes4",
        "o": "LINUX",
        "u": "ugenome",
        "pw": "UbuntuCyb2026\\$"
    },
    {
        "id": 4,
        "m": "Vix46",
        "ip": "192.168.51.91",
        "p": "Ajustes (Sin Validacion) - rpaajustes2",
        "o": "LINUX",
        "u": "ugenome",
        "pw": "UbuntuCyb2026\\$"
    },
    {
        "id": 5,
        "m": "Vix35",
        "ip": "192.168.49.79",
        "p": "Depuracion CC - rpadepuracion1",
        "o": "LINUX",
        "u": "ugenome",
        "pw": "UbuntuCyb2026\\$"
    },
    {
        "id": 6,
        "m": "vix38",
        "ip": "192.168.49.82",
        "p": "Ajustes (Sin Validacion) - rpaajustes3",
        "o": "LINUX",
        "u": "ugenome",
        "pw": "UbuntuCyb2026\\$"
    },
    {
        "id": 7,
        "m": "vix39",
        "ip": "192.168.49.83",
        "p": "Ajustes (Sin Validacion) - rpaajustes4",
        "o": "LINUX",
        "u": "ugenome",
        "pw": "UbuntuCyb2026\\$"
    },
    {
        "id": 8,
        "m": "vix40",
        "ip": "192.168.49.84",
        "p": "Ajustes (Sin Validacion) - rpaajustes4",
        "o": "LINUX",
        "u": "ugenome",
        "pw": "UbuntuCyb2026\\$"
    },
    {
        "id": 9,
        "m": "109 (vix41)",
        "ip": "192.168.49.85",
        "p": "AJUSTES_SV",
        "o": "LINUX",
        "u": "ugenome",
        "pw": "UbuntuCyb2026\\$"
    },
    {
        "id": 10,
        "m": "vix42",
        "ip": "192.168.49.86",
        "p": "Ajustes (Sin Validacion) - rpaajustes2",
        "o": "LINUX",
        "u": "ugenome",
        "pw": "UbuntuCyb2026\\$"
    },
    {
        "id": 11,
        "m": "vix43",
        "ip": "192.168.49.87",
        "p": "Ajustes (Sin Validacion) - rpaajustes1",
        "o": "LINUX",
        "u": "ugenome",
        "pw": "UbuntuCyb2026\\$"
    },
    {
        "id": 12,
        "m": "112 (vix44)",
        "ip": "192.168.49.88",
        "p": "AJUSTES_SV",
        "o": "LINUX",
        "u": "ugenome",
        "pw": "UbuntuCyb2026\\$"
    },
    {
        "id": 13,
        "m": "113 (vix45)",
        "ip": "192.168.49.89",
        "p": "AJUSTES_SV",
        "o": "LINUX",
        "u": "ugenome",
        "pw": "UbuntuCyb2026\\$"
    },
    {
        "id": 14,
        "m": "vix36",
        "ip": "192.168.49.80",
        "p": "Tecnico Ruta 1",
        "o": "LINUX",
        "u": "ugenome",
        "pw": "UbuntuCyb2026\\$"
    },
    {
        "id": 15,
        "m": "115 (vix29)",
        "ip": "192.168.49.32",
        "p": "AJUSTES_SV",
        "o": "LINUX",
        "u": "ugenome",
        "pw": "UbuntuCyb2026\\$"
    },
    {
        "id": 16,
        "m": "116 (vix30)",
        "ip": "192.168.49.33",
        "p": "AJUSTES_SV",
        "o": "LINUX",
        "u": "ugenome",
        "pw": "UbuntuCyb2026\\$"
    },
    {
        "id": 17,
        "m": "117 (vix22)",
        "ip": "192.168.49.34",
        "p": "AJUSTES_SV",
        "o": "LINUX",
        "u": "ugenome",
        "pw": "UbuntuCyb2026\\$"
    },
    {
        "id": 18,
        "m": "vix23",
        "ip": "192.168.49.35",
        "p": "AJUSTES_SV",
        "o": "LINUX",
        "u": "ugenome",
        "pw": "UbuntuCyb2026\\$"
    },
    {
        "id": 19,
        "m": "vix24",
        "ip": "192.168.49.36",
        "p": "Depuracion CC - rpadepuracion4",
        "o": "LINUX",
        "u": "ugenome",
        "pw": "UbuntuCyb2026\\$"
    },
    {
        "id": 20,
        "m": "vix25",
        "ip": "192.168.49.37",
        "p": "Depuracion CC - rpadepuracion2",
        "o": "LINUX",
        "u": "ugenome",
        "pw": "UbuntuCyb2026\\$"
    },
    {
        "id": 21,
        "m": "vix26",
        "ip": "192.168.49.57",
        "p": "Ajustes (Sin Validacion) - rpaajustes2",
        "o": "LINUX",
        "u": "ugenome",
        "pw": "UbuntuCyb2026\\$"
    },
    {
        "id": 22,
        "m": "vix27",
        "ip": "192.168.49.58",
        "p": "CARGO_EXT_CONVENIO",
        "o": "LINUX",
        "u": "ugenome",
        "pw": "UbuntuCyb2026\\$"
    },
    {
        "id": 23,
        "m": "vix28",
        "ip": "192.168.49.40",
        "p": "Libre",
        "o": "WINDOWS",
        "u": "Sistemas",
        "pw": "Cyber123"
    },
    {
        "id": 24,
        "m": "111 (vix31)",
        "ip": "192.168.49.43",
        "p": "CARGO_EXT_CONVENIO",
        "o": "LINUX",
        "u": "ugenome",
        "pw": "UbuntuCyb2026\\$"
    },
    {
        "id": 25,
        "m": "vix21",
        "ip": "192.168.49.90",
        "p": "Ajustes (Sin Validacion) - rpaajustes3",
        "o": "LINUX",
        "u": "ugenome",
        "pw": "UbuntuCyb2026\\$"
    },
    {
        "id": 26,
        "m": "101 (vix47)",
        "ip": "192.168.49.91",
        "p": "AJUSTES_SV",
        "o": "LINUX",
        "u": "ugenome",
        "pw": "UbuntuCyb2026\\$"
    },
    {
        "id": 27,
        "m": "102 (vix48)",
        "ip": "192.168.49.92",
        "p": "AJUSTES_SV",
        "o": "LINUX",
        "u": "ugenome",
        "pw": "UbuntuCyb2026\\$"
    },
    {
        "id": 28,
        "m": "103 (vix49)",
        "ip": "192.168.49.93",
        "p": "AJUSTES_SV",
        "o": "LINUX",
        "u": "ugenome",
        "pw": "UbuntuCyb2026\\$"
    },
    {
        "id": 29,
        "m": "104 (prog24)",
        "ip": "192.168.49.38",
        "p": "NINGUNO",
        "o": "NO",
        "u": "ugenome",
        "pw": "UbuntuCyb2026\\$"
    },
    {
        "id": 30,
        "m": "107 (Mariana1)",
        "ip": "192.168.51.11",
        "p": "MARIANA",
        "o": "WINDOWS",
        "u": "ugenome",
        "pw": "UbuntuCyb2026\\$"
    },
    {
        "id": 31,
        "m": "108 (Mariana2)",
        "ip": "192.168.51.12",
        "p": "MARIANA",
        "o": "WINDOWS",
        "u": "ugenome",
        "pw": "UbuntuCyb2026\\$"
    },
    {
        "id": 32,
        "m": "prog18",
        "ip": "192.168.49.71",
        "p": "OK Cliente 1",
        "o": "LINUX",
        "u": "ugenome",
        "pw": "UbuntuCyb2026\\$"
    },
    {
        "id": 33,
        "m": "prog19",
        "ip": "192.168.49.72",
        "p": "OK Cliente 7",
        "o": "LINUX",
        "u": "ugenome",
        "pw": "UbuntuCyb2026\\$"
    },
    {
        "id": 34,
        "m": "prog20",
        "ip": "192.168.49.73",
        "p": "OK Cliente 6",
        "o": "LINUX",
        "u": "ugenome",
        "pw": "UbuntuCyb2026\\$"
    },
    {
        "id": 35,
        "m": "prog21",
        "ip": "192.168.49.74",
        "p": "OK Cliente 11",
        "o": "LINUX",
        "u": "ugenome",
        "pw": "UbuntuCyb2026\\$"
    },
    {
        "id": 36,
        "m": "prog1",
        "ip": "192.168.51.176",
        "p": "OK Cliente 3",
        "o": "LINUX",
        "u": "ugenome",
        "pw": "UbuntuCyb2026\\$"
    },
    {
        "id": 37,
        "m": "prog8",
        "ip": "192.168.49.75",
        "p": "OK Cliente 11",
        "o": "LINUX",
        "u": "ugenome",
        "pw": "UbuntuCyb2026\\$"
    },
    {
        "id": 38,
        "m": "115 (prog23)",
        "ip": "192.168.49.76",
        "p": "AJUSTES_SV",
        "o": "WINDOWS",
        "u": "Sistemas",
        "pw": "Cyber123"
    },
    {
        "id": 39,
        "m": "prog25",
        "ip": "192.168.49.69",
        "p": "OK Cliente 5",
        "o": "LINUX",
        "u": "ugenome",
        "pw": "UbuntuCyb2026\\$"
    },
    {
        "id": 40,
        "m": "prog26",
        "ip": "192.168.49.68",
        "p": "OK Cliente 4",
        "o": "LINUX",
        "u": "ugenome",
        "pw": "UbuntuCyb2026\\$"
    },
    {
        "id": 42,
        "m": "prog17",
        "ip": "192.168.49.67",
        "p": "OK Cliente 7",
        "o": "LINUX",
        "u": "ugenome",
        "pw": "UbuntuCyb2026\\$"
    },
    {
        "id": 44,
        "m": "Equipo14",
        "ip": "192.168.51.111",
        "p": "FALLAS REPORTADAS",
        "o": "WINDOWS",
        "u": "Sistemas",
        "pw": "Cyber123"
    },
    {
        "id": 45,
        "m": "Equipo13",
        "ip": "192.168.51.108",
        "p": "Tecnico Ruta 2",
        "o": "LINUX",
        "u": "ugenome",
        "pw": "UbuntuCyb2026$"
    },
    {
        "id": 46,
        "m": "Equipo12",
        "ip": "192.168.51.104",
        "p": "FALLAS REPORTADAS",
        "o": "WINDOWS",
        "u": "Sistemas",
        "pw": "Cyber123"
    },
    {
        "id": 47,
        "m": "124 (Equipo11)",
        "ip": "192.168.51.101",
        "p": "AJUSTES_SV",
        "o": "WINDOWS",
        "u": "Sistemas",
        "pw": "Cyber123"
    },
    {
        "id": 48,
        "m": "Equipo10",
        "ip": "192.168.51.96",
        "p": "Tecnico Ruta 4",
        "o": "LINUX",
        "u": "ugenome",
        "pw": "UbuntuCyb2026$"
    },
    {
        "id": 49,
        "m": "Equipo9",
        "ip": "192.168.51.95",
        "p": "ORDENES_DUPLICADAS",
        "o": "WINDOWS",
        "u": "Sistemas",
        "pw": "Cyber123"
    },
    {
        "id": 50,
        "m": "127 (Equipo19)",
        "ip": "192.168.49.94",
        "p": "AJUSTES_SV",
        "o": "WINDOWS",
        "u": "Sistemas",
        "pw": "Cyber123"
    },
    {
        "id": 51,
        "m": "128 (Equipo18)",
        "ip": "192.168.49.178",
        "p": "AJUSTES_SV",
        "o": "WINDOWS",
        "u": "Sistemas",
        "pw": "Cyber123"
    },
    {
        "id": 52,
        "m": "Equipo8",
        "ip": "192.168.51.44",
        "p": "RPA Flag de Confirmacion 2",
        "o": "LINUX",
        "u": "ugenome",